{
  "schemaVersion": "1.0",
  "kind": "lesson-task-card",
  "lessonId": "ma-g9-health-u06-l02",
  "courseId": "ma-g9-health",
  "grade": 9,
  "subject": "health",
  "unitNumber": 6,
  "unitTitle": "Personal Wellness, Communicable Conditions, and HIV Basics",
  "title": "Explicit model: how communicable conditions transmit and how transmission is interrupted",
  "focus": "how communicable conditions transmit and how transmission is interrupted",
  "essentialQuestion": "How do everyday wellness habits and accurate information reduce risk for me and the people around me?",
  "estimatedMinutes": "35–55",
  "materials": [
    "course notebook or digital equivalent",
    "guardian-approved public-health reference sources"
  ],
  "keyPoints": [],
  "privacySafeScenario": "Build an accuracy brief that corrects four fictional but realistic myths about transmission, using cited reliable sources and non-stigmatizing language.",
  "studentTask": "Learner applies how communicable conditions transmit and how transmission is interrupted to a new fictional scenario and records the response with the reasoning, evidence, or decision process behind it.",
  "knowledgeCheck": "In one concise response, show or explain the most important idea about how communicable conditions transmit and how transmission is interrupted, then name one check that would catch a weak claim or an unsafe step.",
  "completionCriteria": [
    "The learner completes the central task about how communicable conditions transmit and how transmission is interrupted without being asked for any private disclosure.",
    "The learner gives evidence, reasoning, a documented process, or a cited source rather than an unsupported claim.",
    "The learner checks or revises the work and can identify a next step."
  ],
  "adaptationChoices": "The brief may be written, typed, recorded as spoken notes for an adult, or built as a labeled chart. Reading load may be reduced by using summarized source extracts.",
  "extensionChallenge": "Apply how communicable conditions transmit and how transmission is interrupted under a new constraint, compare two approaches, or explain the idea to someone else with an original fictional example, without completing another learner's graded work.",
  "accessibilitySupports": [
    "Provide readable text plus optional audio or read-aloud support; no voice feature is required.",
    "Chunk directions into one action at a time and show a worked example or model.",
    "Allow typed, handwritten, spoken, drawn, manipulatives-based, or demonstrated responses when the standard permits.",
    "Offer reduced-copying, extended-time, hidden-timer, movement-break, and low-distraction options.",
    "Use captions, alt text, high-contrast print, keyboard access, and text-only fallbacks for media.",
    "Preserve the learning target while adjusting quantity, pacing, representation, or response mode.",
    "The brief may be written, typed, recorded as spoken notes for an adult, or built as a labeled chart. Reading load may be reduced by using summarized source extracts."
  ],
  "trustedAdultNote": "This course teaches health information and does not diagnose; direct urgent safety or health concerns to a trusted adult or qualified professional.",
  "optionalReflection": {
    "prompt": "Invite the learner to notice one safe, optional example of how communicable conditions transmit and how transmission is interrupted in daily life. No purchase, account creation, photograph, recording, or private disclosure is required.",
    "private": true,
    "graded": false,
    "optional": true
  },
  "neverRequires": [
    "This task never requires body weight, height, BMI, or body-fat percentage.",
    "This task never requires calorie counting or a diet or weight-loss goal.",
    "This task never requires disclosing private medical history, a diagnosis, or sexual history.",
    "This task never requires a photograph, video, or voice recording of the learner as proof.",
    "This task never requires a public performance or an audience."
  ],
  "sourceProvenance": {
    "sourceBranch": "mac/hs912-health-pe-r1@e39e2b3",
    "sourceLessonId": "ma-g9-health-u06-l02"
  },
  "productionReadiness": {
    "status": "READY",
    "codes": [
      "READY"
    ]
  }
}
