{
  "schemaVersion": "1.0",
  "kind": "lesson-task-card",
  "lessonId": "ma-g5-physical-education-u09-l08",
  "courseId": "ma-g5-physical-education",
  "grade": 5,
  "subject": "physical-education",
  "unitNumber": 9,
  "unitTitle": "Personal Activity Portfolio and Celebration",
  "title": "Reteach and varied practice: goal review",
  "focus": "goal review",
  "essentialQuestion": "How can understanding personal activity portfolio and celebration help us explain, decide, create, or solve something that matters?",
  "estimatedMinutes": "35–60",
  "materials": [
    "course notebook or digital equivalent",
    "pencil or accessible response tool",
    "unit-specific source, model, manipulatives, safe materials, or approved digital tool"
  ],
  "movementCues": null,
  "commonErrorToWatchFor": null,
  "keyPoints": [],
  "privacySafeScenario": "Present a personal activity portfolio focused on skill, confidence, enjoyment, safety, and next steps.",
  "studentTask": "Learner completes a new application of goal review and records both the result and the reasoning, evidence, process, or design choice that produced it.",
  "knowledgeCheck": "In one concise response, show or explain the most important idea about goal review; then identify one check that would catch an error or weak claim.",
  "completionCriteria": [
    "The learner completes the central task about goal review.",
    "The learner gives evidence, reasoning, a model, or a documented process rather than an unsupported answer.",
    "The learner checks or revises the work and can identify a next step."
  ],
  "adaptationChoices": "Provide readable text plus optional audio or read-aloud support; no voice feature is required. Chunk directions into one action at a time and show a worked example or model. Allow typed, handwritten, spoken, drawn, manipulatives-based, or demonstrated responses when the standard permits. Offer reduced-copying, extended-time, hidden-timer, movement-break, and low-distraction options. Use captions, alt text, high-contrast print, keyboard access, and text-only fallbacks for media. Preserve the learning target while adjusting quantity, pacing, representation, or response mode.",
  "extensionChallenge": "Apply goal review under a new constraint, compare two approaches or perspectives, or teach the idea with an original example without completing another learner’s graded work.",
  "accessibilitySupports": [
    "Provide readable text plus optional audio or read-aloud support; no voice feature is required.",
    "Chunk directions into one action at a time and show a worked example or model.",
    "Allow typed, handwritten, spoken, drawn, manipulatives-based, or demonstrated responses when the standard permits.",
    "Offer reduced-copying, extended-time, hidden-timer, movement-break, and low-distraction options.",
    "Use captions, alt text, high-contrast print, keyboard access, and text-only fallbacks for media.",
    "Preserve the learning target while adjusting quantity, pacing, representation, or response mode."
  ],
  "optionalReflection": {
    "prompt": "Invite the learner to notice one safe, optional example of goal review in daily life. No purchase, account creation, photograph, or private disclosure is required.",
    "private": true,
    "graded": false,
    "optional": true
  },
  "neverRequires": [
    "This task never requires body weight, height, BMI, or body-fat percentage.",
    "This task never requires calorie counting or a diet or weight-loss goal.",
    "This task never requires disclosing private medical history, a diagnosis, or sexual history.",
    "This task never requires a photograph, video, or voice recording of the learner as proof.",
    "This task never requires a public performance or an audience."
  ],
  "sourceProvenance": {
    "sourceBranch": "shared base@656efba (canonical 5/7/8)",
    "sourceLessonId": "ma-g5-physical-education-u09-l08"
  },
  "productionReadiness": {
    "status": "READY",
    "codes": [
      "READY"
    ]
  }
}
