{
  "schemaVersion": "1.0",
  "kind": "lesson-task-card",
  "lessonId": "ma-g3-physical-education-u04-l03",
  "courseId": "ma-g3-physical-education",
  "grade": 3,
  "subject": "physical-education",
  "unitNumber": 4,
  "unitTitle": "Throwing and Catching",
  "title": "Guided practice A: catching above and below the waist",
  "focus": "catching above and below the waist",
  "essentialQuestion": "How do I send and receive an object accurately?",
  "estimatedMinutes": "30-50",
  "materials": [
    "open, cleared movement space",
    "water available throughout",
    "unit equipment listed in the guardian safety review"
  ],
  "movementCues": [
    "Above the waist: thumbs together, fingers up.",
    "Below the waist: little fingers together, fingers down.",
    "Watch the object all the way into your hands.",
    "Give with the catch — pull the hands in to absorb it softly."
  ],
  "commonErrorToWatchFor": "Closing the eyes or turning the head away. Fix: use a soft, slow, larger object until the learner keeps their eyes on it.",
  "keyPoints": [
    "Above the waist: thumbs together, fingers up.",
    "Below the waist: little fingers together, fingers down.",
    "Watch the object all the way into your hands.",
    "Give with the catch — pull the hands in to absorb it softly."
  ],
  "privacySafeScenario": "Complete a personal throw-and-catch challenge at a distance you choose, and name which cue made your throw and your catch more controlled. Nothing is counted, timed, or recorded as a score.",
  "studentTask": "The learner practises catching above and below the waist at a self-selected challenge level, using the adapted alternative whenever it fits better, and names the cue that helped.",
  "knowledgeCheck": "The learner names one cue that helped with catching above and below the waist and one adjustment for next time, by demonstrating, describing, drawing, or writing.",
  "completionCriteria": [
    "The learner takes part in the task about catching above and below the waist at a self-selected challenge level.",
    "The learner uses or names the movement cues for catching above and below the waist.",
    "The learner identifies one adjustment or next step. No score, time, count, or measurement is required."
  ],
  "adaptationChoices": "Throwing, catching, and object control may use a larger, lighter, slower, or bounced object; a shorter distance; a rolled rather than thrown delivery; a scoop or two hands; or a stationary target. A learner may also direct a partner and analyze the result instead of performing the skill.",
  "extensionChallenge": "Apply catching above and below the waist under one new condition of the learner choosing — different equipment, space, speed, or partner — and describe what changed.",
  "accessibilitySupports": [
    "Provide readable text plus optional audio or read-aloud support; no voice feature is required.",
    "Chunk directions into one action at a time and show or describe a model before practice.",
    "Allow demonstrated, described, drawn, spoken, signed, or written evidence; the response mode is never the standard being assessed.",
    "Offer reduced-repetition, extended-time, hidden-timer, rest-break, and low-stimulation options.",
    "Use captions, alt text, high-contrast print, keyboard access, and text-only fallbacks for any media.",
    "Preserve the movement target while adjusting equipment, distance, speed, force, duration, or support."
  ],
  "optionalReflection": {
    "prompt": "Invite the learner to enjoy one safe, optional activity that practises catching above and below the waist. No purchase, account creation, recording, measurement, or public performance is required.",
    "private": true,
    "graded": false,
    "optional": true
  },
  "neverRequires": [
    "This task never requires body weight, height, BMI, or body-fat percentage.",
    "This task never requires calorie counting or a diet or weight-loss goal.",
    "This task never requires disclosing private medical history, a diagnosis, or sexual history.",
    "This task never requires a photograph, video, or voice recording of the learner as proof.",
    "This task never requires a public performance or an audience."
  ],
  "sourceProvenance": {
    "sourceBranch": "mac/g34-health-pe-r1@d0ebaa0",
    "sourceLessonId": "ma-g3-physical-education-u04-l03"
  },
  "productionReadiness": {
    "status": "READY",
    "codes": [
      "READY"
    ]
  }
}
