{
  "schemaVersion": "1.0",
  "kind": "lesson-task-card",
  "lessonId": "ma-g10-physical-education-u09-l02",
  "courseId": "ma-g10-physical-education",
  "grade": 10,
  "subject": "physical-education",
  "unitNumber": 9,
  "unitTitle": "Grade 10 Capstone: Personal Activity Plan and LEVEL 1 Transition",
  "title": "Concept model A: self-assessment against the five standards",
  "focus": "self-assessment against the five standards",
  "essentialQuestion": "What have I built that is worth specializing in?",
  "estimatedMinutes": "35–60",
  "materials": [
    "the Grade 9 and Grade 10 portfolios"
  ],
  "movementCues": null,
  "commonErrorToWatchFor": null,
  "keyPoints": [],
  "privacySafeScenario": "Present a LEVEL 1 completion file and a justified LEVEL 2 specialization proposal to one trusted adult, and revise the proposal after critique.",
  "studentTask": "Learner applies self-assessment against the five standards in a new situation at a self-set intensity and records what they did, noticed, and would adjust.",
  "knowledgeCheck": "In one concise response, explain the key idea behind self-assessment against the five standards and name one adjustment for the next session.",
  "completionCriteria": [
    "The learner completes or fully describes the self-assessment against the five standards task using a version their body and setting allow.",
    "The learner gives a cue, principle, tactic, or documented process rather than an unexplained result.",
    "The learner self-assesses against the stated criteria and identifies one next adjustment."
  ],
  "adaptationChoices": "Presentation may be spoken one-to-one, written, or submitted as an annotated document. No recording, photograph, or audience beyond one adult is required.",
  "extensionChallenge": "Apply self-assessment against the five standards under a new constraint, in a different activity, or teach the cue to someone else — without completing another learner's graded work.",
  "accessibilitySupports": [
    "Provide readable text plus optional audio or read-aloud support; no voice feature is required.",
    "Chunk directions into one action at a time and show a worked example or model.",
    "Allow typed, handwritten, spoken, drawn, demonstrated, or described responses when the standard permits.",
    "Offer reduced-copying, extended-time, hidden-timer, rest-break, and low-distraction options.",
    "Use captions, alt text, high-contrast print, keyboard access, and text-only fallbacks for media.",
    "Preserve the learning target while adjusting quantity, pacing, intensity, range, equipment, or response mode.",
    "Every movement task has a seated, supported, reduced-range, reduced-pace, and solo version that reaches the same standard.",
    "Presentation may be spoken one-to-one, written, or submitted as an annotated document. No recording, photograph, or audience beyond one adult is required."
  ],
  "optionalReflection": {
    "prompt": "Invite the learner to notice or try one safe, optional example of self-assessment against the five standards in daily life. No purchase, account creation, photograph, recording, or public performance is required.",
    "private": true,
    "graded": false,
    "optional": true
  },
  "neverRequires": [
    "This task never requires body weight, height, BMI, or body-fat percentage.",
    "This task never requires calorie counting or a diet or weight-loss goal.",
    "This task never requires disclosing private medical history, a diagnosis, or sexual history.",
    "This task never requires a photograph, video, or voice recording of the learner as proof.",
    "This task never requires a public performance or an audience."
  ],
  "sourceProvenance": {
    "sourceBranch": "mac/hs912-health-pe-r1@e39e2b3",
    "sourceLessonId": "ma-g10-physical-education-u09-l02"
  },
  "productionReadiness": {
    "status": "READY",
    "codes": [
      "READY"
    ]
  }
}
