{
  "schemaVersion": "1.0",
  "kind": "lesson-task-card",
  "lessonId": "ma-g3-physical-education-u09-l01",
  "courseId": "ma-g3-physical-education",
  "grade": 3,
  "subject": "physical-education",
  "unitNumber": 9,
  "unitTitle": "Cooperative Games, Fair Play, and Lifetime Activity",
  "title": "Launch and diagnostic: following rules and playing fairly",
  "focus": "following rules and playing fairly",
  "essentialQuestion": "How do fair rules and good teamwork make activity better for everyone?",
  "estimatedMinutes": "30-50",
  "materials": [
    "open, cleared movement space",
    "water available throughout",
    "unit equipment listed in the guardian safety review"
  ],
  "movementCues": [
    "Rules exist to keep play safe and fair for everyone.",
    "Agree the rules before starting, not during an argument.",
    "Call your own faults honestly.",
    "Winning by cheating is not winning."
  ],
  "commonErrorToWatchFor": "Renegotiating rules mid-game when losing. Fix: agree and restate the rules aloud before the first point.",
  "keyPoints": [
    "Rules exist to keep play safe and fair for everyone.",
    "Agree the rules before starting, not during an argument.",
    "Call your own faults honestly.",
    "Winning by cheating is not winning."
  ],
  "privacySafeScenario": "Adapt a familiar game so a learner with a different ability, size, or energy level can fully take part, then play it and review what worked.",
  "studentTask": "The learner practises following rules and playing fairly at a self-selected challenge level, using the adapted alternative whenever it fits better, and names the cue that helped.",
  "knowledgeCheck": "The learner names one cue that helped with following rules and playing fairly and one adjustment for next time, by demonstrating, describing, drawing, or writing.",
  "completionCriteria": [
    "The learner takes part in the task about following rules and playing fairly at a self-selected challenge level.",
    "The learner uses or names the movement cues for following rules and playing fairly.",
    "The learner identifies one adjustment or next step. No score, time, count, or measurement is required."
  ],
  "adaptationChoices": "Games are adapted so every learner has a real role: adjustable boundaries, extra passes, a designated safe zone, a slower or larger object, a seated or stationary position, and role options including player, coach, official, or strategist. Any rule may be changed to include a learner rather than excluding them. Where a task asks the learner to lead or officiate, they may lead one adult, officiate a scripted scenario, or write and justify the plan instead; leading is never done in front of an audience.",
  "extensionChallenge": "Apply following rules and playing fairly under one new condition of the learner choosing — different equipment, space, speed, or partner — and describe what changed.",
  "accessibilitySupports": [
    "Provide readable text plus optional audio or read-aloud support; no voice feature is required.",
    "Chunk directions into one action at a time and show or describe a model before practice.",
    "Allow demonstrated, described, drawn, spoken, signed, or written evidence; the response mode is never the standard being assessed.",
    "Offer reduced-repetition, extended-time, hidden-timer, rest-break, and low-stimulation options.",
    "Use captions, alt text, high-contrast print, keyboard access, and text-only fallbacks for any media.",
    "Preserve the movement target while adjusting equipment, distance, speed, force, duration, or support."
  ],
  "optionalReflection": {
    "prompt": "Invite the learner to enjoy one safe, optional activity that practises following rules and playing fairly. No purchase, account creation, recording, measurement, or public performance is required.",
    "private": true,
    "graded": false,
    "optional": true
  },
  "neverRequires": [
    "This task never requires body weight, height, BMI, or body-fat percentage.",
    "This task never requires calorie counting or a diet or weight-loss goal.",
    "This task never requires disclosing private medical history, a diagnosis, or sexual history.",
    "This task never requires a photograph, video, or voice recording of the learner as proof.",
    "This task never requires a public performance or an audience."
  ],
  "sourceProvenance": {
    "sourceBranch": "mac/g34-health-pe-r1@d0ebaa0",
    "sourceLessonId": "ma-g3-physical-education-u09-l01"
  },
  "productionReadiness": {
    "status": "READY",
    "codes": [
      "READY"
    ]
  }
}
