{
  "schemaVersion": "1.0",
  "kind": "lesson-task-card",
  "lessonId": "ma-g12-health-u03-l02",
  "courseId": "ma-g12-health",
  "grade": 12,
  "subject": "health",
  "unitNumber": 3,
  "unitTitle": "Mental Health Maintenance and Sustainable Coping",
  "title": "Explicit model: maintenance strategies versus emergency strategies",
  "focus": "maintenance strategies versus emergency strategies",
  "essentialQuestion": "How do I keep myself steady through a transition that removes most of my structure?",
  "estimatedMinutes": "35–55",
  "materials": [
    "course notebook or digital equivalent",
    "guardian-approved adult support resource list"
  ],
  "keyPoints": [],
  "privacySafeScenario": "Write a transition plan with maintenance strategies, early-warning conditions the learner will watch for, and a concrete first step for getting professional support — including how it would be paid for and accessed.",
  "studentTask": "Learner applies maintenance strategies versus emergency strategies to a new fictional scenario and records the response with the reasoning, evidence, or decision process behind it.",
  "knowledgeCheck": "In one concise response, show or explain the most important idea about maintenance strategies versus emergency strategies, then name one check that would catch a weak claim or an unsafe step.",
  "completionCriteria": [
    "The learner completes the central task about maintenance strategies versus emergency strategies without being asked for any private disclosure.",
    "The learner gives evidence, reasoning, a documented process, or a cited source rather than an unsupported claim.",
    "The learner checks or revises the work and can identify a next step."
  ],
  "adaptationChoices": "The plan may be written, spoken, or assembled from supplied strategy cards. General categories may be used throughout instead of specific personal detail.",
  "extensionChallenge": "Apply maintenance strategies versus emergency strategies under a new constraint, compare two approaches, or explain the idea to someone else with an original fictional example, without completing another learner's graded work.",
  "accessibilitySupports": [
    "Provide readable text plus optional audio or read-aloud support; no voice feature is required.",
    "Chunk directions into one action at a time and show a worked example or model.",
    "Allow typed, handwritten, spoken, drawn, manipulatives-based, or demonstrated responses when the standard permits.",
    "Offer reduced-copying, extended-time, hidden-timer, movement-break, and low-distraction options.",
    "Use captions, alt text, high-contrast print, keyboard access, and text-only fallbacks for media.",
    "Preserve the learning target while adjusting quantity, pacing, representation, or response mode.",
    "The plan may be written, spoken, or assembled from supplied strategy cards. General categories may be used throughout instead of specific personal detail."
  ],
  "trustedAdultNote": "This course teaches health information and does not diagnose; direct urgent safety or health concerns to a trusted adult or qualified professional.",
  "optionalReflection": {
    "prompt": "Invite the learner to notice one safe, optional example of maintenance strategies versus emergency strategies in daily life. No purchase, account creation, photograph, recording, or private disclosure is required.",
    "private": true,
    "graded": false,
    "optional": true
  },
  "neverRequires": [
    "This task never requires body weight, height, BMI, or body-fat percentage.",
    "This task never requires calorie counting or a diet or weight-loss goal.",
    "This task never requires disclosing private medical history, a diagnosis, or sexual history.",
    "This task never requires a photograph, video, or voice recording of the learner as proof.",
    "This task never requires a public performance or an audience."
  ],
  "sourceProvenance": {
    "sourceBranch": "mac/hs912-health-pe-r1@e39e2b3",
    "sourceLessonId": "ma-g12-health-u03-l02"
  },
  "productionReadiness": {
    "status": "READY",
    "codes": [
      "READY"
    ]
  }
}
