{
  "schemaVersion": "1.0",
  "kind": "lesson-task-card",
  "lessonId": "ma-g9-physical-education-u07-l06",
  "courseId": "ma-g9-physical-education",
  "grade": 9,
  "subject": "physical-education",
  "unitNumber": 7,
  "unitTitle": "Outdoor and Community Activity Foundations",
  "title": "Guided practice B: finding free public activity spaces in a community",
  "focus": "finding free public activity spaces in a community",
  "essentialQuestion": "What does it take to be active outside safely and repeatedly?",
  "estimatedMinutes": "35–60",
  "materials": [
    "weather-appropriate clothing",
    "water",
    "course notebook or digital equivalent"
  ],
  "movementCues": null,
  "commonErrorToWatchFor": null,
  "keyPoints": [],
  "privacySafeScenario": "Plan and complete one guardian-approved outdoor activity, including the safety plan, and produce a map of free activity spaces reachable from home.",
  "studentTask": "Learner applies finding free public activity spaces in a community in a new situation at a self-set intensity and records what they did, noticed, and would adjust.",
  "knowledgeCheck": "In one concise response, explain the key idea behind finding free public activity spaces in a community and name one adjustment for the next session.",
  "completionCriteria": [
    "The learner completes or fully describes the finding free public activity spaces in a community task using a version their body and setting allow.",
    "The learner gives a cue, principle, tactic, or documented process rather than an unexplained result.",
    "The learner self-assesses against the stated criteria and identifies one next adjustment."
  ],
  "adaptationChoices": "Distance, duration, terrain, and pace are learner-set. An indoor or home-yard equivalent is available in full for any learner for whom outdoor activity is unsafe, inaccessible, or not approved.",
  "extensionChallenge": "Apply finding free public activity spaces in a community under a new constraint, in a different activity, or teach the cue to someone else — without completing another learner's graded work.",
  "accessibilitySupports": [
    "Provide readable text plus optional audio or read-aloud support; no voice feature is required.",
    "Chunk directions into one action at a time and show a worked example or model.",
    "Allow typed, handwritten, spoken, drawn, demonstrated, or described responses when the standard permits.",
    "Offer reduced-copying, extended-time, hidden-timer, rest-break, and low-distraction options.",
    "Use captions, alt text, high-contrast print, keyboard access, and text-only fallbacks for media.",
    "Preserve the learning target while adjusting quantity, pacing, intensity, range, equipment, or response mode.",
    "Every movement task has a seated, supported, reduced-range, reduced-pace, and solo version that reaches the same standard.",
    "Distance, duration, terrain, and pace are learner-set. An indoor or home-yard equivalent is available in full for any learner for whom outdoor activity is unsafe, inaccessible, or not approved."
  ],
  "optionalReflection": {
    "prompt": "Invite the learner to notice or try one safe, optional example of finding free public activity spaces in a community in daily life. No purchase, account creation, photograph, recording, or public performance is required.",
    "private": true,
    "graded": false,
    "optional": true
  },
  "neverRequires": [
    "This task never requires body weight, height, BMI, or body-fat percentage.",
    "This task never requires calorie counting or a diet or weight-loss goal.",
    "This task never requires disclosing private medical history, a diagnosis, or sexual history.",
    "This task never requires a photograph, video, or voice recording of the learner as proof.",
    "This task never requires a public performance or an audience."
  ],
  "sourceProvenance": {
    "sourceBranch": "mac/hs912-health-pe-r1@e39e2b3",
    "sourceLessonId": "ma-g9-physical-education-u07-l06"
  },
  "productionReadiness": {
    "status": "READY",
    "codes": [
      "READY"
    ]
  }
}
