{
  "schemaVersion": "1.0",
  "kind": "lesson-task-card",
  "lessonId": "ma-g10-health-u02-l04",
  "courseId": "ma-g10-health",
  "grade": 10,
  "subject": "health",
  "unitNumber": 2,
  "unitTitle": "Healthy Relationships, Boundaries, and Consent",
  "title": "Application or project: recognizing pressure, manipulation, and control tactics",
  "focus": "recognizing pressure, manipulation, and control tactics",
  "essentialQuestion": "What does respect look like in practice when a boundary is inconvenient for someone?",
  "estimatedMinutes": "35–55",
  "materials": [
    "course notebook or digital equivalent",
    "course-supplied fictional scenario set"
  ],
  "keyPoints": [],
  "privacySafeScenario": "Build a boundary and consent script set for four fictional situations, including one where the boundary is not accepted the first time, and identify the exit and support step for each.",
  "studentTask": "Learner applies recognizing pressure, manipulation, and control tactics to a new fictional scenario and records the response with the reasoning, evidence, or decision process behind it.",
  "knowledgeCheck": "In one concise response, show or explain the most important idea about recognizing pressure, manipulation, and control tactics, then name one check that would catch a weak claim or an unsafe step.",
  "completionCriteria": [
    "The learner completes the central task about recognizing pressure, manipulation, and control tactics without being asked for any private disclosure.",
    "The learner gives evidence, reasoning, a documented process, or a cited source rather than an unsupported claim.",
    "The learner checks or revises the work and can identify a next step."
  ],
  "adaptationChoices": "Scripts may be written, typed, spoken privately to an adult, signed, or assembled from a supplied phrase bank. No role-play in front of an audience is required.",
  "extensionChallenge": "Apply recognizing pressure, manipulation, and control tactics under a new constraint, compare two approaches, or explain the idea to someone else with an original fictional example, without completing another learner's graded work.",
  "accessibilitySupports": [
    "Provide readable text plus optional audio or read-aloud support; no voice feature is required.",
    "Chunk directions into one action at a time and show a worked example or model.",
    "Allow typed, handwritten, spoken, drawn, manipulatives-based, or demonstrated responses when the standard permits.",
    "Offer reduced-copying, extended-time, hidden-timer, movement-break, and low-distraction options.",
    "Use captions, alt text, high-contrast print, keyboard access, and text-only fallbacks for media.",
    "Preserve the learning target while adjusting quantity, pacing, representation, or response mode.",
    "Scripts may be written, typed, spoken privately to an adult, signed, or assembled from a supplied phrase bank. No role-play in front of an audience is required."
  ],
  "trustedAdultNote": "This course teaches health information and does not diagnose; direct urgent safety or health concerns to a trusted adult or qualified professional.",
  "optionalReflection": {
    "prompt": "Invite the learner to notice one safe, optional example of recognizing pressure, manipulation, and control tactics in daily life. No purchase, account creation, photograph, recording, or private disclosure is required.",
    "private": true,
    "graded": false,
    "optional": true
  },
  "neverRequires": [
    "This task never requires body weight, height, BMI, or body-fat percentage.",
    "This task never requires calorie counting or a diet or weight-loss goal.",
    "This task never requires disclosing private medical history, a diagnosis, or sexual history.",
    "This task never requires a photograph, video, or voice recording of the learner as proof.",
    "This task never requires a public performance or an audience."
  ],
  "sourceProvenance": {
    "sourceBranch": "mac/hs912-health-pe-r1@e39e2b3",
    "sourceLessonId": "ma-g10-health-u02-l04"
  },
  "productionReadiness": {
    "status": "READY",
    "codes": [
      "READY"
    ]
  }
}
