{
  "schemaVersion": "1.0",
  "kind": "lesson-task-card",
  "lessonId": "ma-g4-health-u03-l01",
  "courseId": "ma-g4-health",
  "grade": 4,
  "subject": "health",
  "unitNumber": 3,
  "unitTitle": "Emotional Health and Managing Stress",
  "title": "Launch and diagnostic: emotion vocabulary and intensity",
  "focus": "emotion vocabulary and intensity",
  "essentialQuestion": "How can I manage strong feelings and know when to reach for support?",
  "estimatedMinutes": "30-45",
  "materials": [
    "course notebook or digital equivalent",
    "pencil or accessible response tool",
    "cards or paper for a coping toolkit",
    "optional timer for a calming practice"
  ],
  "keyPoints": [
    "Precise words give better options: disappointed, overwhelmed, resentful, anxious, relieved, content.",
    "Intensity matters — irritated, angry, and furious call for different responses.",
    "Two feelings can be present at once, such as excited and nervous.",
    "Naming a feeling accurately tends to reduce its intensity."
  ],
  "privacySafeScenario": "Someone says only \"I am fine\" while slamming doors. Offer three more accurate words and say what each would suggest doing.",
  "studentTask": "The learner applies what they learned about emotion vocabulary and intensity to a new fictional situation and records the choice plus the reason behind it.",
  "knowledgeCheck": "Name one thing you already knew about emotion vocabulary and intensity and one question you now have.",
  "completionCriteria": [
    "The learner completes the central task about emotion vocabulary and intensity.",
    "The learner gives a reason, an example, or a documented process rather than an unsupported answer.",
    "The learner checks or revises the work and can name one next step."
  ],
  "adaptationChoices": "Coping strategies may be movement-based, still, sensory, verbal, or silent, and each learner selects strategies their body and setting allow. Scenario responses may be pointed to, chosen from options, drawn, spoken, or written.",
  "extensionChallenge": "Apply what you learned about emotion vocabulary and intensity under a new constraint, compare two reasonable approaches, or teach the idea to a family member with an original fictional example.",
  "accessibilitySupports": [
    "Provide readable text plus optional audio or read-aloud support; no voice feature is required.",
    "Chunk directions into one action at a time and show a worked example or model.",
    "Allow typed, handwritten, spoken, signed, drawn, or pointed responses; the response mode is never the standard being assessed.",
    "Offer reduced-copying, extended-time, hidden-timer, movement-break, and low-distraction options.",
    "Use captions, alt text, high-contrast print, keyboard access, and text-only fallbacks for any media.",
    "Preserve the learning target while adjusting quantity, pacing, representation, or response mode."
  ],
  "trustedAdultNote": "Direct urgent safety, health, or mental-health concerns to a trusted adult or qualified professional; this course is not diagnosis, therapy, or treatment.",
  "optionalReflection": {
    "prompt": "With a guardian, agree one signal you can use at home that means \"I need a few minutes\". This is optional. No purchase, account creation, photograph, measurement, or private disclosure is required.",
    "private": true,
    "graded": false,
    "optional": true
  },
  "neverRequires": [
    "This task never requires body weight, height, BMI, or body-fat percentage.",
    "This task never requires calorie counting or a diet or weight-loss goal.",
    "This task never requires disclosing private medical history, a diagnosis, or sexual history.",
    "This task never requires a photograph, video, or voice recording of the learner as proof.",
    "This task never requires a public performance or an audience."
  ],
  "sourceProvenance": {
    "sourceBranch": "mac/g34-health-pe-r1@d0ebaa0",
    "sourceLessonId": "ma-g4-health-u03-l01"
  },
  "productionReadiness": {
    "status": "READY",
    "codes": [
      "READY"
    ]
  }
}
