{
  "schemaVersion": "1.0",
  "kind": "lesson-task-card",
  "lessonId": "ma-g11-health-u01-l05",
  "courseId": "ma-g11-health",
  "grade": 11,
  "subject": "health",
  "unitNumber": 1,
  "unitTitle": "Evaluating Health Information, Products, and Services",
  "title": "Mastery check: conflict of interest and funding disclosure",
  "focus": "conflict of interest and funding disclosure",
  "essentialQuestion": "What separates a health claim that holds up from one that only sounds like it does?",
  "estimatedMinutes": "35–55",
  "materials": [
    "course notebook or digital equivalent",
    "course-supplied fictional product and service descriptions",
    "guardian-approved reference sources"
  ],
  "keyPoints": [],
  "privacySafeScenario": "Produce a consumer-grade evaluation of three fictional health products or services, ranking them on evidence, safety, cost, and accountability, and stating the one piece of missing information that would change the ranking.",
  "studentTask": "Learner applies conflict of interest and funding disclosure to a new fictional scenario and records the response with the reasoning, evidence, or decision process behind it.",
  "knowledgeCheck": "In one concise response, show or explain the most important idea about conflict of interest and funding disclosure, then name one check that would catch a weak claim or an unsafe step.",
  "completionCriteria": [
    "The learner completes the central task about conflict of interest and funding disclosure without being asked for any private disclosure.",
    "The learner gives evidence, reasoning, a documented process, or a cited source rather than an unsupported claim.",
    "The learner checks or revises the work and can identify a next step."
  ],
  "adaptationChoices": "Evaluations may be written, tabled, dictated, or completed against a supplied criteria rubric with a reduced item count.",
  "extensionChallenge": "Apply conflict of interest and funding disclosure under a new constraint, compare two approaches, or explain the idea to someone else with an original fictional example, without completing another learner's graded work.",
  "accessibilitySupports": [
    "Provide readable text plus optional audio or read-aloud support; no voice feature is required.",
    "Chunk directions into one action at a time and show a worked example or model.",
    "Allow typed, handwritten, spoken, drawn, manipulatives-based, or demonstrated responses when the standard permits.",
    "Offer reduced-copying, extended-time, hidden-timer, movement-break, and low-distraction options.",
    "Use captions, alt text, high-contrast print, keyboard access, and text-only fallbacks for media.",
    "Preserve the learning target while adjusting quantity, pacing, representation, or response mode.",
    "Evaluations may be written, tabled, dictated, or completed against a supplied criteria rubric with a reduced item count."
  ],
  "trustedAdultNote": "This course teaches health information and does not diagnose; direct urgent safety or health concerns to a trusted adult or qualified professional.",
  "optionalReflection": {
    "prompt": "Invite the learner to notice one safe, optional example of conflict of interest and funding disclosure in daily life. No purchase, account creation, photograph, recording, or private disclosure is required.",
    "private": true,
    "graded": false,
    "optional": true
  },
  "neverRequires": [
    "This task never requires body weight, height, BMI, or body-fat percentage.",
    "This task never requires calorie counting or a diet or weight-loss goal.",
    "This task never requires disclosing private medical history, a diagnosis, or sexual history.",
    "This task never requires a photograph, video, or voice recording of the learner as proof.",
    "This task never requires a public performance or an audience."
  ],
  "sourceProvenance": {
    "sourceBranch": "mac/hs912-health-pe-r1@e39e2b3",
    "sourceLessonId": "ma-g11-health-u01-l05"
  },
  "productionReadiness": {
    "status": "READY",
    "codes": [
      "READY"
    ]
  }
}
