{
  "schemaVersion": "1.0",
  "kind": "lesson-task-card",
  "lessonId": "ma-g11-physical-education-u04-l08",
  "courseId": "ma-g11-physical-education",
  "grade": 11,
  "subject": "physical-education",
  "unitNumber": 4,
  "unitTitle": "Advanced Tactics and Game Sense",
  "title": "Reteach and varied practice: decision speed under constraint under transfer",
  "focus": "decision speed under constraint",
  "essentialQuestion": "How do experienced players decide faster than they can think?",
  "estimatedMinutes": "35–60",
  "materials": [
    "equipment for the chosen activity",
    "course notebook or digital equivalent"
  ],
  "movementCues": null,
  "commonErrorToWatchFor": null,
  "keyPoints": [],
  "privacySafeScenario": "Design a constraints-led practice that forces a specific tactical decision, run it, and evaluate whether the decision improved — then teach the idea to one other person or write the coaching script.",
  "studentTask": "Learner works decision speed under constraint under a constraint-led practice the learner designs, then coached to another person who has to succeed with it at a self-set intensity, then records what held, what degraded first, and how this occasion differed from the earlier one.",
  "knowledgeCheck": "In one concise response, say which feature of decision speed under constraint degraded first under the added demand, why, and what you would change before the next attempt.",
  "completionCriteria": [
    "The learner holds decision speed under constraint under a constraint-led practice the learner designs, then coached to another person who has to succeed with it, in whatever version their body and setting allow.",
    "The learner names what degraded first and why, rather than reporting only whether it worked.",
    "The learner compares this occasion with the earlier one and says what actually changed."
  ],
  "adaptationChoices": "Practice may be run live, walked through, simulated on paper, or modelled on a diagram; the tactical reasoning is what is assessed.",
  "extensionChallenge": "Design the next progression of decision speed under constraint yourself, or coach the transfer condition to someone else so that they succeed with it — without completing another learner's graded work.",
  "accessibilitySupports": [
    "Provide readable text plus optional audio or read-aloud support; no voice feature is required.",
    "Chunk directions into one action at a time and show a worked example or model.",
    "Allow typed, handwritten, spoken, drawn, demonstrated, or described responses when the standard permits.",
    "Offer reduced-copying, extended-time, hidden-timer, rest-break, and low-distraction options.",
    "Use captions, alt text, high-contrast print, keyboard access, and text-only fallbacks for media.",
    "Preserve the learning target while adjusting quantity, pacing, intensity, range, equipment, or response mode.",
    "Every movement task has a seated, supported, reduced-range, reduced-pace, and solo version that reaches the same standard.",
    "Practice may be run live, walked through, simulated on paper, or modelled on a diagram; the tactical reasoning is what is assessed."
  ],
  "optionalReflection": {
    "prompt": "Invite the learner to notice where decision speed under constraint shows up outside the session under real conditions. No purchase, account creation, photograph, recording, or public performance is required.",
    "private": true,
    "graded": false,
    "optional": true
  },
  "neverRequires": [
    "This task never requires body weight, height, BMI, or body-fat percentage.",
    "This task never requires calorie counting or a diet or weight-loss goal.",
    "This task never requires disclosing private medical history, a diagnosis, or sexual history.",
    "This task never requires a photograph, video, or voice recording of the learner as proof.",
    "This task never requires a public performance or an audience."
  ],
  "sourceProvenance": {
    "sourceBranch": "mac/hs912-health-pe-r1@e39e2b3",
    "sourceLessonId": "ma-g11-physical-education-u04-l08"
  },
  "productionReadiness": {
    "status": "READY",
    "codes": [
      "READY"
    ]
  }
}
