{
  "schemaVersion": "1.0",
  "kind": "lesson-task-card",
  "lessonId": "ma-g4-health-u01-l01",
  "courseId": "ma-g4-health",
  "grade": 4,
  "subject": "health",
  "unitNumber": 1,
  "unitTitle": "How My Body Works and Stays Well",
  "title": "Launch and diagnostic: body systems working together",
  "focus": "body systems working together",
  "essentialQuestion": "How do my body systems and my daily habits work together to keep me well?",
  "estimatedMinutes": "30-45",
  "materials": [
    "course notebook or digital equivalent",
    "pencil or accessible response tool",
    "a simple body-systems diagram or model",
    "paper or a digital tool for a prevention routine"
  ],
  "keyPoints": [
    "Systems cooperate: the respiratory system takes in oxygen, the circulatory system carries it, and muscles use it.",
    "The digestive system breaks food into fuel the blood can deliver.",
    "The skeleton supports and protects; the skin is the first barrier against germs.",
    "Because systems are connected, a habit like sleep or hydration affects several at once."
  ],
  "privacySafeScenario": "Running upstairs leaves you breathing hard with a fast heartbeat. Which systems are responding, and why do both change together?",
  "studentTask": "The learner applies what they learned about body systems working together to a new fictional situation and records the choice plus the reason behind it.",
  "knowledgeCheck": "Name one thing you already knew about body systems working together and one question you now have.",
  "completionCriteria": [
    "The learner completes the central task about body systems working together.",
    "The learner gives a reason, an example, or a documented process rather than an unsupported answer.",
    "The learner checks or revises the work and can name one next step."
  ],
  "adaptationChoices": "Diagrams may be replaced with text descriptions, tactile models, or spoken explanation. Any routine step a learner cannot perform independently is planned as an adult-supported step, which counts fully.",
  "extensionChallenge": "Apply what you learned about body systems working together under a new constraint, compare two reasonable approaches, or teach the idea to a family member with an original fictional example.",
  "accessibilitySupports": [
    "Provide readable text plus optional audio or read-aloud support; no voice feature is required.",
    "Chunk directions into one action at a time and show a worked example or model.",
    "Allow typed, handwritten, spoken, signed, drawn, or pointed responses; the response mode is never the standard being assessed.",
    "Offer reduced-copying, extended-time, hidden-timer, movement-break, and low-distraction options.",
    "Use captions, alt text, high-contrast print, keyboard access, and text-only fallbacks for any media.",
    "Preserve the learning target while adjusting quantity, pacing, representation, or response mode."
  ],
  "trustedAdultNote": "Direct urgent safety, health, or mental-health concerns to a trusted adult or qualified professional; this course is not diagnosis, therapy, or treatment.",
  "optionalReflection": {
    "prompt": "With a guardian, find out where the household keeps its first-aid supplies and the doctor or clinic contact details. This is optional. No purchase, account creation, photograph, measurement, or private disclosure is required.",
    "private": true,
    "graded": false,
    "optional": true
  },
  "neverRequires": [
    "This task never requires body weight, height, BMI, or body-fat percentage.",
    "This task never requires calorie counting or a diet or weight-loss goal.",
    "This task never requires disclosing private medical history, a diagnosis, or sexual history.",
    "This task never requires a photograph, video, or voice recording of the learner as proof.",
    "This task never requires a public performance or an audience."
  ],
  "sourceProvenance": {
    "sourceBranch": "mac/g34-health-pe-r1@d0ebaa0",
    "sourceLessonId": "ma-g4-health-u01-l01"
  },
  "productionReadiness": {
    "status": "READY",
    "codes": [
      "READY"
    ]
  }
}
