{
  "schemaVersion": "1.0",
  "kind": "lesson-task-card",
  "lessonId": "ma-g3-health-u04-l04",
  "courseId": "ma-g3-health",
  "grade": 3,
  "subject": "health",
  "unitNumber": 4,
  "unitTitle": "Friends, Boundaries, and Speaking Up",
  "title": "Application or project: secrets, surprises, and telling",
  "focus": "secrets, surprises, and telling",
  "essentialQuestion": "How do respectful words and clear boundaries keep me and my friendships safe?",
  "estimatedMinutes": "30-45",
  "materials": [
    "course notebook or digital equivalent",
    "pencil or accessible response tool",
    "paper or cards for scripts"
  ],
  "keyPoints": [
    "A surprise is happy and gets told soon, like a birthday present.",
    "A secret you are told to keep forever, especially about touching or about your body, is not safe and should be told.",
    "Adults who ask a child to keep a secret from their guardian are breaking a rule, even if they are known and liked.",
    "Threats and bribes are warning signs, not reasons to stay quiet.",
    "Telling is always the right thing to do, even when someone says you will be in trouble for it."
  ],
  "privacySafeScenario": "Someone gives Alex a present and says \"this is our secret, do not tell your mom.\" What kind of secret is that, and what should Alex do?",
  "studentTask": "The learner applies what they learned about secrets, surprises, and telling to a new fictional situation and records the choice plus the reason behind it.",
  "knowledgeCheck": "Show one part of your project that uses secrets, surprises, and telling and say why you made that choice.",
  "completionCriteria": [
    "The learner completes the central task about secrets, surprises, and telling.",
    "The learner gives a reason, an example, or a documented process rather than an unsupported answer.",
    "The learner checks or revises the work and can name one next step."
  ],
  "adaptationChoices": "Scripts may be spoken, signed, typed, drawn as a comic, or acted with figures or puppets. Role-play is optional and may always be replaced by describing what a character should say.",
  "extensionChallenge": "Apply what you learned about secrets, surprises, and telling under a new constraint, compare two reasonable approaches, or teach the idea to a family member with an original fictional example.",
  "accessibilitySupports": [
    "Provide readable text plus optional audio or read-aloud support; no voice feature is required.",
    "Chunk directions into one action at a time and show a worked example or model.",
    "Allow typed, handwritten, spoken, signed, drawn, or pointed responses; the response mode is never the standard being assessed.",
    "Offer reduced-copying, extended-time, hidden-timer, movement-break, and low-distraction options.",
    "Use captions, alt text, high-contrast print, keyboard access, and text-only fallbacks for any media.",
    "Preserve the learning target while adjusting quantity, pacing, representation, or response mode."
  ],
  "trustedAdultNote": "Direct urgent safety, health, or mental-health concerns to a trusted adult or qualified professional; this course is not diagnosis, therapy, or treatment.",
  "optionalReflection": {
    "prompt": "With a guardian, agree on the family rule for secrets and who is always safe to tell. This is optional. No purchase, account creation, photograph, measurement, or private disclosure is required.",
    "private": true,
    "graded": false,
    "optional": true
  },
  "neverRequires": [
    "This task never requires body weight, height, BMI, or body-fat percentage.",
    "This task never requires calorie counting or a diet or weight-loss goal.",
    "This task never requires disclosing private medical history, a diagnosis, or sexual history.",
    "This task never requires a photograph, video, or voice recording of the learner as proof.",
    "This task never requires a public performance or an audience."
  ],
  "sourceProvenance": {
    "sourceBranch": "mac/g3-health-h2@50399a6fb6ae095907c0fde25db2a15ca85c6f1f",
    "sourceLessonId": "ma-g3-health-u04-l04"
  },
  "productionReadiness": {
    "status": "READY",
    "codes": [
      "READY"
    ]
  }
}
